{
  "task_id": "T-031",
  "phase": "closeout",
  "model": "minimax-m3:cloud",
  "profile": "economy",
  "started_at": "2026-07-14T05:30:00Z",
  "completed_at": "2026-07-14T05:35:00Z",
  "exit_code": 0,
  "status": "completed",
  "files_read": [
    ".ai/context/active-task.json",
    ".ai/context/repository-map.json",
    ".ai/model-routing.json",
    ".ai/model-routing.schema.json",
    ".ai/model-classification.json",
    ".ai/templates/phase-receipt.schema.json",
    ".ai/templates/implementation-receipt.schema.json",
    ".ai/prompts/phases/closeout.md",
    ".ai/state/tasks.json",
    ".ai/state/session.json",
    ".ai/workflows/branching-strategy.md",
    "DECISIONS.md",
    "ROADMAP.md"
  ],
  "files_changed": [],
  "commands_run": [
    "git status",
    "git diff --stat",
    "git log --oneline -5",
    "git checkout main",
    "git merge --ff-only feature/T-031-ai-session-router",
    "git branch -d feature/T-031-ai-session-router"
  ],
  "targeted_tests": [],
  "validation": {
    "syntax_ok": true,
    "schema_ok": true,
    "pester_ok": true,
    "dry_run_ok": true,
    "notes": "All PowerShell scripts parse; every .ai/**/*.json parses; router -Command Status, -Command Next -DryRun, -Command Plan -DryRun, -Command Resume, -Command Configure all run cleanly. Pester tests are mocked; no real ollama invocation; no paid cloud quota consumed."
  },
  "decisions": [
    "Single focused commit on feature/T-031-ai-session-router",
    "Fast-forward merge into main (no merge commit)",
    "Feature branch deleted locally per branching strategy rule 7",
    "No push to origin (push_authorization_required is true; the brief prohibits push)",
    "Router written to UTF-8 without BOM (Set-Content -Encoding UTF8 emits a BOM by default in PowerShell 5.1; Out-File -Encoding utf8NoBOM is the canonical fix)",
    "T-030 remains Ready; the queue is not advanced past it"
  ],
  "blockers": [],
  "next_phase": null,
  "retry_recommended": false,
  "fallback_recommended": false,
  "usage": {
    "unknown": true
  },
  "receipt_version": "1.0.0",
  "commit_sha": "08438d7",
  "report_path": "implementation-report-autonomous-model-routing-optimization.md"
}
